"team","fatigue_score","arms_tired","arms_rested","high_lev_available","top_arms_detail","fetched_at"
"ARI","0.562","3","1","0","Kevin Ginkel (pitched yest, avail:0.5) | Taylor Clarke (pitched yest, avail:0.5) | Drey Jameson (pitched yest, avail:0.5)","2026-07-06 16:15 UTC"
"ATH","0.43","5","1","0","Elvis Alvarado (pitched yest, avail:0.297) | Mason Barnett (pitched yest, avail:0.425) | Justin Sterner (pitched yest, avail:0.5)","2026-07-06 16:15 UTC"
"ATL","0.481","4","4","0","Carlos Carrasco (pitched yest, avail:0.425) | Tyler Kinley (pitched yest, avail:0.5) | Dylan Dodd (pitched yest, avail:0.5)","2026-07-06 16:15 UTC"
"BAL","0.688","1","0","1","Rico Garcia (pitched yest, avail:0.5) | Tyler Wells (1d rest, avail:0.75) | Yennier Cano (1d rest, avail:0.75)","2026-07-06 16:15 UTC"
"BOS","0.444","5","0","0","Greg Weissert (pitched yest, avail:0.35) | Tyron Guerrero (pitched yest, avail:0.425) | Garrett Whitlock (pitched yest, avail:0.5)","2026-07-06 16:15 UTC"
"CHC","0.406","4","2","0","Tyler Ferguson (pitched yest, avail:0.35) | Ryan Rolison (pitched yest, avail:0.35) | Jacob Webb (pitched yest, avail:0.425)","2026-07-06 16:15 UTC"
"CIN","0.544","3","2","0","Emilio Pagán (pitched yest, avail:0.425) | Tejay Antone (pitched yest, avail:0.5) | Brock Burke (pitched yest, avail:0.5)","2026-07-06 16:15 UTC"
"CLE","0.35","7","1","0","Hunter Gaddis (pitched yest, avail:0.2) | Shawn Armstrong (pitched yest, avail:0.35) | Tim Herrin (pitched yest, avail:0.35)","2026-07-06 16:15 UTC"
"COL","0.463","4","2","0","Jordan Romano (pitched yest, avail:0.35) | Victor Vodnik (pitched yest, avail:0.5) | Brennan Bernardino (pitched yest, avail:0.5)","2026-07-06 16:15 UTC"
"CWS","0.463","4","3","0","Chris Murphy (pitched yest, avail:0.425) | Erick Fedde (pitched yest, avail:0.425) | Sean Newcomb (pitched yest, avail:0.5)","2026-07-06 16:15 UTC"
"DET","0.562","3","2","0","Kenley Jansen (pitched yest, avail:0.5) | Drew Sommers (pitched yest, avail:0.5) | Drew Anderson (pitched yest, avail:0.5)","2026-07-06 16:15 UTC"
"HOU","0.487","3","1","0","Josh Hader (pitched yest, avail:0.35) | Bryan King (pitched yest, avail:0.35) | Steven Okert (pitched yest, avail:0.5)","2026-07-06 16:15 UTC"
"KCR","0.5","4","3","0","Daniel Lynch IV (pitched yest, avail:0.5) | John Schreiber (pitched yest, avail:0.5) | Matt Strahm (pitched yest, avail:0.5)","2026-07-06 16:15 UTC"
"LAA","0.43","5","1","0","Chase Silseth (pitched yest, avail:0.297) | José Fermin (pitched yest, avail:0.425) | Mitch Farris (pitched yest, avail:0.5)","2026-07-06 16:15 UTC"
"LAD","0.525","3","2","0","Paul Gervase (pitched yest, avail:0.425) | Jack Dreyer (pitched yest, avail:0.425) | Kyle Hurt (pitched yest, avail:0.5)","2026-07-06 16:15 UTC"
"MIA","0.525","3","5","0","Lake Bachar (pitched yest, avail:0.425) | Pete Fairbanks (pitched yest, avail:0.425) | Michael Petersen (pitched yest, avail:0.5)","2026-07-06 16:15 UTC"
"MIL","0.5","5","3","0","Grant Anderson (pitched yest, avail:0.5) | Abner Uribe (pitched yest, avail:0.5) | Aaron Ashby (pitched yest, avail:0.5)","2026-07-06 16:15 UTC"
"MIN","0.588","2","2","1","Andrew Morris (pitched yest, avail:0.35) | Yoendrys Gómez (pitched yest, avail:0.5) | Marco Raya (1d rest, avail:0.75)","2026-07-06 16:15 UTC"
"NYM","0.5","4","2","0","Huascar Brazobán (pitched yest, avail:0.5) | Luke Weaver (pitched yest, avail:0.5) | Devin Williams (pitched yest, avail:0.5)","2026-07-06 16:15 UTC"
"NYY","0.425","4","2","0","Jake Bird (pitched yest, avail:0.35) | Camilo Doval (pitched yest, avail:0.35) | Paul Blackburn (pitched yest, avail:0.5)","2026-07-06 16:15 UTC"
"PHI","0.625","2","2","1","Kyle Backhus (pitched yest, avail:0.5) | Seth Johnson (pitched yest, avail:0.5) | Jonathan Bowlan (1d rest, avail:0.75)","2026-07-06 16:15 UTC"
"PIT","0.406","4","2","0","Mason Montgomery (pitched yest, avail:0.35) | Dennis Santana (pitched yest, avail:0.35) | Gregory Soto (pitched yest, avail:0.425)","2026-07-06 16:15 UTC"
"SDP","0.444","4","1","0","Mason Miller (pitched yest, avail:0.35) | Adrian Morejon (pitched yest, avail:0.425) | Yuki Matsui (pitched yest, avail:0.5)","2026-07-06 16:15 UTC"
"SEA","0.688","2","4","1","Andrés Muñoz (pitched yest, avail:0.5) | Gabe Speier (pitched yest, avail:0.5) | Cole Wilcox (1d rest, avail:0.75)","2026-07-06 16:15 UTC"
"SFG","0.425","4","3","0","Dylan Smith (pitched yest, avail:0.35) | Sam Hentges (pitched yest, avail:0.35) | Adrian Houser (pitched yest, avail:0.5)","2026-07-06 16:15 UTC"
"STL","0.606","2","4","1","Matt Svanson (pitched yest, avail:0.425) | Ryan Fernandez (pitched yest, avail:0.5) | JoJo Romero (1d rest, avail:0.75)","2026-07-06 16:15 UTC"
"TBR","0.588","2","2","1","Craig Kimbrel (pitched yest, avail:0.35) | Cam Booser (pitched yest, avail:0.5) | Garrett Cleavinger (1d rest, avail:0.75)","2026-07-06 16:15 UTC"
"TEX","0.481","4","0","0","Gavin Collyer (pitched yest, avail:0.425) | Peyton Gray (pitched yest, avail:0.5) | Robby Ahlstrom (pitched yest, avail:0.5)","2026-07-06 16:15 UTC"
"TOR","0.606","2","2","1","Mason Fluharty (pitched yest, avail:0.425) | Tyler Rogers (pitched yest, avail:0.5) | Tommy Nance (1d rest, avail:0.75)","2026-07-06 16:15 UTC"
"WSH","0.463","5","2","0","Brad Lord (pitched yest, avail:0.425) | Eddy Yean (pitched yest, avail:0.425) | Justin Lawrence (pitched yest, avail:0.5)","2026-07-06 16:15 UTC"
