game_date,team,player,transaction_type,txn_date,description,relevant_today
2026-07-16,NYM,Zack Short,Designated for Assignment,2026-07-16,New York Mets designated SS Zack Short for assignment.,1
2026-07-16,PHI,Brad Keller,Status Change,2026-07-16,"Philadelphia Phillies placed RHP Brad Keller on the 15-day injured list retroactive to July 13, 2026. Right elbow UCL tear.",1
2026-07-16,NYM,Marcus Semien,Status Change,2026-07-16,New York Mets activated 2B Marcus Semien from the 10-day injured list.,1
2026-07-16,PHI,Seth Johnson,Recalled,2026-07-16,Philadelphia Phillies recalled RHP Seth Johnson from Lehigh Valley IronPigs.,1
2026-07-16,NYM,Zach Thornton,Recalled,2026-07-12,New York Mets recalled LHP Zach Thornton from Syracuse Mets.,1
